{
  "$schema": "https://json-schema.org/draft/2020-12/schema",
  "$id": "https://eliasworks.dev/blueprint/0.5.4/client-architecture.schema.json",
  "title": "Blueprint Client Slice Architecture Binding",
  "type": "object",
  "required": ["schema_version", "architecture_id", "project_id", "mode", "interface_slice", "platform", "inventory_ids", "status", "platform_baseline_ref", "visual_references", "api_binding", "routing", "async_states", "idempotency", "slice_overrides", "implementation_guardrails"],
  "properties": {
    "schema_version": {"enum": ["0.5.0", "0.5.4"]},
    "architecture_id": {"type": "string", "pattern": "^CLIENT-(WEB|ANDROID|IOS)-[A-Z0-9][A-Z0-9._-]*$"},
    "project_id": {"type": "string", "minLength": 1},
    "mode": {"enum": ["greenfield", "brownfield"]},
    "interface_slice": {"type": "string", "pattern": "^[a-z0-9][a-z0-9._-]*$"},
    "platform": {"enum": ["web", "android", "ios"]},
    "inventory_ids": {"type": "array", "minItems": 1, "uniqueItems": true, "items": {"type": "string", "pattern": "^(WEB|APP|IOS)-[0-9]{3,}$"}},
    "status": {"enum": ["DRAFT", "READY_FOR_REVIEW", "APPROVED"]},
    "platform_baseline_ref": {"type": "string", "minLength": 1},
    "visual_references": {"type": "object", "required": ["mode", "approved_reference_paths"], "properties": {"mode": {"enum": ["none", "approved_optional"]}, "approved_reference_paths": {"type": "array", "uniqueItems": true, "items": {"type": "string", "minLength": 1}}}, "allOf": [{"if": {"properties": {"mode": {"const": "none"}}, "required": ["mode"]}, "then": {"properties": {"approved_reference_paths": {"maxItems": 0}}}}, {"if": {"properties": {"mode": {"const": "approved_optional"}}, "required": ["mode"]}, "then": {"properties": {"approved_reference_paths": {"minItems": 1}}}}], "additionalProperties": false},
    "api_binding": {"type": "object", "required": ["openapi_path", "revision", "operation_ids", "permissions"], "properties": {"openapi_path": {"type": "string", "minLength": 1}, "revision": {"type": "string", "minLength": 1}, "operation_ids": {"type": "array", "uniqueItems": true, "items": {"type": "string", "minLength": 1}}, "permissions": {"type": "array", "uniqueItems": true, "items": {"type": "string", "minLength": 1}}}, "additionalProperties": false},
    "routing": {"type": "object", "required": ["routes", "permission_aware_navigation"], "properties": {"routes": {"type": "array", "uniqueItems": true, "items": {"type": "string", "minLength": 1}}, "permission_aware_navigation": {"type": "boolean"}}, "additionalProperties": false},
    "async_states": {"type": "object", "required": ["loading", "empty", "error", "401", "403", "404", "409", "422", "429", "offline"], "properties": {"loading": {"enum": ["REQUIRED", "NOT_APPLICABLE"]}, "empty": {"enum": ["REQUIRED", "NOT_APPLICABLE"]}, "error": {"enum": ["REQUIRED", "NOT_APPLICABLE"]}, "401": {"enum": ["REQUIRED", "NOT_APPLICABLE"]}, "403": {"enum": ["REQUIRED", "NOT_APPLICABLE"]}, "404": {"enum": ["REQUIRED", "NOT_APPLICABLE"]}, "409": {"enum": ["REQUIRED", "NOT_APPLICABLE"]}, "422": {"enum": ["REQUIRED", "NOT_APPLICABLE"]}, "429": {"enum": ["REQUIRED", "NOT_APPLICABLE"]}, "offline": {"enum": ["REQUIRED", "NOT_APPLICABLE"]}}, "additionalProperties": false},
    "idempotency": {"type": "object", "required": ["required_operations", "key_generation", "replay_handling", "conflict_handling"], "properties": {"required_operations": {"type": "array", "uniqueItems": true, "items": {"type": "string", "minLength": 1}}, "key_generation": {"type": "string", "minLength": 1}, "replay_handling": {"type": "string", "minLength": 1}, "conflict_handling": {"type": "string", "minLength": 1}}, "additionalProperties": false},
    "slice_overrides": {"type": "object", "properties": {"cache_invalidation": {"type": "array", "uniqueItems": true, "items": {"type": "string", "minLength": 1}}, "offline_override": {"enum": ["inherit", "unsupported", "degraded", "read_only", "queued_writes", "full_offline"]}, "testing_notes": {"type": "array", "uniqueItems": true, "items": {"type": "string", "minLength": 1}}}, "additionalProperties": false},
    "implementation_guardrails": {"type": "object", "required": ["api_authoritative", "no_new_api_behavior", "approved_inventory_only", "no_hardcoded_authoritative_business_data"], "properties": {"api_authoritative": {"const": true}, "no_new_api_behavior": {"const": true}, "approved_inventory_only": {"const": true}, "no_hardcoded_authoritative_business_data": {"const": true}}, "additionalProperties": false}
  },
  "allOf": [
    {"if": {"properties": {"platform": {"const": "web"}}, "required": ["platform"]}, "then": {"properties": {"architecture_id": {"pattern": "^CLIENT-WEB-[A-Z0-9][A-Z0-9._-]*$"}, "inventory_ids": {"items": {"pattern": "^WEB-[0-9]{3,}$"}}}}},
    {"if": {"properties": {"platform": {"const": "android"}}, "required": ["platform"]}, "then": {"properties": {"architecture_id": {"pattern": "^CLIENT-ANDROID-[A-Z0-9][A-Z0-9._-]*$"}, "inventory_ids": {"items": {"pattern": "^APP-[0-9]{3,}$"}}}}},
    {"if": {"properties": {"platform": {"const": "ios"}}, "required": ["platform"]}, "then": {"properties": {"architecture_id": {"pattern": "^CLIENT-IOS-[A-Z0-9][A-Z0-9._-]*$"}, "inventory_ids": {"items": {"pattern": "^IOS-[0-9]{3,}$"}}}}}
  ],
  "additionalProperties": false
}
