{"schema_version":"0.5.0","architecture_id":"CLIENT-ANDROID-OPS-MOBILE","project_id":"example-project","mode":"greenfield","interface_slice":"ops-mobile","platform":"android","inventory_ids":["APP-001","APP-002"],"status":"READY_FOR_REVIEW","platform_baseline_ref":"templates/client-platform-architecture.android.example.json","visual_references":{"mode":"none","approved_reference_paths":[]},"api_binding":{"openapi_path":"tests/fixtures/artifact-graph/openapi.yaml","revision":"api-rev-2","operation_ids":["loginUser"],"permissions":[]},"routing":{"routes":["login","home","task-detail"],"permission_aware_navigation":true},"async_states":{"loading":"REQUIRED","empty":"REQUIRED","error":"REQUIRED","401":"REQUIRED","403":"REQUIRED","404":"REQUIRED","409":"REQUIRED","422":"REQUIRED","429":"REQUIRED","offline":"REQUIRED"},"idempotency":{"required_operations":[],"key_generation":"Generate UUID only for operations marked idempotent by the API contract.","replay_handling":"Use canonical replay response and avoid duplicate local side effects.","conflict_handling":"Block changed-payload reuse of the same idempotency key."},"slice_overrides":{"cache_invalidation":["Refresh affected aggregate after successful mutation."],"offline_override":"inherit","testing_notes":["Exercise navigation, auth and offline transitions on emulator/device."]},"implementation_guardrails":{"api_authoritative":true,"no_new_api_behavior":true,"approved_inventory_only":true,"no_hardcoded_authoritative_business_data":true}}