{"schema_version":"0.5.0","architecture_id":"CLIENT-WEB-OPERATIONAL-CORE","project_id":"example-project","mode":"brownfield","interface_slice":"operational-core","platform":"web","inventory_ids":["WEB-001","WEB-004"],"status":"APPROVED","platform_baseline_ref":"templates/client-platform-architecture.web.example.json","visual_references":{"mode":"none","approved_reference_paths":[]},"api_binding":{"openapi_path":"tests/fixtures/artifact-graph/openapi.yaml","revision":"api-rev-2","operation_ids":["loginUser","getDashboard"],"permissions":["dashboard.view","alerts.view"]},"routing":{"routes":["/login","/dashboard"],"permission_aware_navigation":true},"async_states":{"loading":"REQUIRED","empty":"REQUIRED","error":"REQUIRED","401":"REQUIRED","403":"REQUIRED","404":"NOT_APPLICABLE","409":"NOT_APPLICABLE","422":"REQUIRED","429":"REQUIRED","offline":"REQUIRED"},"idempotency":{"required_operations":[],"key_generation":"Generate one UUID per user intent only when the API contract marks the mutation idempotent.","replay_handling":"Treat documented replay response as canonical and avoid duplicate optimistic effects.","conflict_handling":"Block same-key reuse with a changed payload."},"slice_overrides":{"cache_invalidation":["Invalidate dashboard summary after successful operations affecting its aggregates."],"offline_override":"inherit","testing_notes":["Exercise login and dashboard against the real test API."]},"implementation_guardrails":{"api_authoritative":true,"no_new_api_behavior":true,"approved_inventory_only":true,"no_hardcoded_authoritative_business_data":true}}